{
  "schemaVersion": 1,
  "requester": {
    "component": "gateway",
    "assignment": "gateway.json",
    "refresh": []
  },
  "recipient": {
    "component": "identity",
    "assignment": "identity.json",
    "refresh": []
  },
  "dependency": {
    "from": "gateway",
    "to": "identity",
    "contract": "identity-label",
    "delivery": "Verified formatIdentity result includes label `Identity: <id>` while preserving id"
  },
  "acceptance": [
    {
      "id": "combined",
      "command": "node",
      "args": [
        "../checks/workday-contract.mjs"
      ],
      "artifacts": [
        "../checks/workday-contract.mjs"
      ]
    }
  ]
}
